{
  "schema_version": 1,
  "cipher_suite": "aes_256_gcm",
  "provider_role": "business",
  "key_version": 1,
  "ciphertext_base64": "Zml4dHVyZS1jaXBoZXJ0ZXh0",
  "nonce_base64": "AAAAAAAAAAAAAAAA",
  "wrapped_dek_base64": "Zml4dHVyZS13cmFwcGVkLWRlaw==",
  "aad_fields": [
    "schema_version",
    "secret_id",
    "secret_kind",
    "provider_role",
    "owner_type",
    "owner_id",
    "purpose",
    "key_version"
  ]
}
